{
    "schemaVersion":  "1.0.0",
    "workPackage":  "M0-SAV-01",
    "generatedAtUtc":  "2026-07-12T16:31:21.5632250Z",
    "executionStatus":  "InProgress",
    "gateStatus":  "Blocked",
    "blockerCode":  "EvidenceMissing",
    "result":  "Partial",
    "catalogId":  "gemuera.m0.legacy-save-baseline",
    "catalogVersion":  "1.0.0",
    "catalogHash":  "1bb6edaa4b2c0dab806cfb9d8ef56271b5cc41982926f23f2b625cc627ba3ad7",
    "saveBaselineSetHash":  "0c4507f40f95bab072b06777982412511b8e38793c288fdaa1ec1cd1a991ea58",
    "sourceFiles":  [
                        {
                            "relativePath":  "Scripts/Emuera/GameData/Variable/CharacterData.cs",
                            "sha256":  "970bc419bd65e1633e57837faced3b80f914abfbb0c82c87f8f9697996d0211c",
                            "byteLength":  39537
                        },
                        {
                            "relativePath":  "Scripts/Emuera/GameData/Variable/VariableData.cs",
                            "sha256":  "4d83f6f6946301968e0268771e26fc564fd56e80869d5ebc0c907ef9bf047f7c",
                            "byteLength":  66269
                        },
                        {
                            "relativePath":  "Scripts/Emuera/GameData/Variable/VariableEvaluator.cs",
                            "sha256":  "920fab29e87cdb00ab73be41ef051fadf13e078537e2921a29fafdcbf2450e42",
                            "byteLength":  118924
                        },
                        {
                            "relativePath":  "Scripts/Emuera/Sub/EraBinaryDataReader.cs",
                            "sha256":  "72d4d8041799d61e7c1379bdc7af18071054e56601709a027e98353d46018014",
                            "byteLength":  31720
                        },
                        {
                            "relativePath":  "Scripts/Emuera/Sub/EraBinaryDataWriter.cs",
                            "sha256":  "bb963bce35f50f0a8d60c3d461aef4b4ce509e5de4d318383315fc2f27f1cf53",
                            "byteLength":  13666
                        }
                    ],
    "protocolCounts":  {
                           "sourceFileCount":  5,
                           "fileTypeCount":  4,
                           "dataTypeCount":  19,
                           "sparseMarkerCount":  11,
                           "profileCandidateCount":  2,
                           "legacyMutationEvidenceCount":  2
                       },
    "header":  {
                   "headerHex":  "0x0A1A0A0D41524589",
                   "zipHeaderHex":  "0x0A50495A41524589",
                   "formatVersion":  1808,
                   "dataCount":  0,
                   "minimumBytes":  16,
                   "encoding":  "Encoding.Unicode"
               },
    "fileTypes":  [
                      {
                          "id":  "Normal",
                          "hexCode":  "0x00",
                          "pathForms":  [
                                            "save{index:00}.sav",
                                            "save{name:00}.sav"
                                        ],
                          "writerMethod":  "SaveToStreamBinary",
                          "readerMethod":  "LoadFromStreamBinary",
                          "sourceStatus":  "ObservedStatic"
                      },
                      {
                          "id":  "Global",
                          "hexCode":  "0x01",
                          "pathForms":  [
                                            "global.sav"
                                        ],
                          "writerMethod":  "WriteGlobalSaveStream",
                          "readerMethod":  "LoadGlobal",
                          "sourceStatus":  "ObservedStatic"
                      },
                      {
                          "id":  "Var",
                          "hexCode":  "0x02",
                          "pathForms":  [
                                            "var_{id}.dat"
                                        ],
                          "writerMethod":  "SaveVariable",
                          "readerMethod":  "LoadVariable",
                          "sourceStatus":  "ObservedStatic"
                      },
                      {
                          "id":  "CharVar",
                          "hexCode":  "0x03",
                          "pathForms":  [
                                            "chara_{id}.dat"
                                        ],
                          "writerMethod":  "SaveChara",
                          "readerMethod":  "LoadChara",
                          "sourceStatus":  "ObservedStatic"
                      }
                  ],
    "dataTypes":  [
                      {
                          "id":  "Int",
                          "hexCode":  "0x00",
                          "sourceStatus":  "ObservedStatic"
                      },
                      {
                          "id":  "IntArray",
                          "hexCode":  "0x01",
                          "sourceStatus":  "ObservedStatic"
                      },
                      {
                          "id":  "IntArray2D",
                          "hexCode":  "0x02",
                          "sourceStatus":  "ObservedStatic"
                      },
                      {
                          "id":  "IntArray3D",
                          "hexCode":  "0x03",
                          "sourceStatus":  "ObservedStatic"
                      },
                      {
                          "id":  "PcFloat",
                          "hexCode":  "0x04",
                          "sourceStatus":  "ObservedStatic"
                      },
                      {
                          "id":  "PcFloatArray",
                          "hexCode":  "0x05",
                          "sourceStatus":  "ObservedStatic"
                      },
                      {
                          "id":  "PcFloatArray2D",
                          "hexCode":  "0x06",
                          "sourceStatus":  "ObservedStatic"
                      },
                      {
                          "id":  "PcFloatArray3D",
                          "hexCode":  "0x07",
                          "sourceStatus":  "ObservedStatic"
                      },
                      {
                          "id":  "Str",
                          "hexCode":  "0x10",
                          "sourceStatus":  "ObservedStatic"
                      },
                      {
                          "id":  "StrArray",
                          "hexCode":  "0x11",
                          "sourceStatus":  "ObservedStatic"
                      },
                      {
                          "id":  "StrArray2D",
                          "hexCode":  "0x12",
                          "sourceStatus":  "ObservedStatic"
                      },
                      {
                          "id":  "StrArray3D",
                          "hexCode":  "0x13",
                          "sourceStatus":  "ObservedStatic"
                      },
                      {
                          "id":  "Float",
                          "hexCode":  "0x20",
                          "sourceStatus":  "ObservedStatic"
                      },
                      {
                          "id":  "FloatArray",
                          "hexCode":  "0x21",
                          "sourceStatus":  "ObservedStatic"
                      },
                      {
                          "id":  "FloatArray2D",
                          "hexCode":  "0x22",
                          "sourceStatus":  "ObservedStatic"
                      },
                      {
                          "id":  "FloatArray3D",
                          "hexCode":  "0x23",
                          "sourceStatus":  "ObservedStatic"
                      },
                      {
                          "id":  "Separator",
                          "hexCode":  "0xFD",
                          "sourceStatus":  "ObservedStatic"
                      },
                      {
                          "id":  "EOC",
                          "hexCode":  "0xFE",
                          "sourceStatus":  "ObservedStatic"
                      },
                      {
                          "id":  "EOF",
                          "hexCode":  "0xFF",
                          "sourceStatus":  "ObservedStatic"
                      }
                  ],
    "sparseMarkers":  [
                          {
                              "id":  "Byte",
                              "hexCode":  "0xCF",
                              "sourceStatus":  "ObservedStatic"
                          },
                          {
                              "id":  "Int16",
                              "hexCode":  "0xD0",
                              "sourceStatus":  "ObservedStatic"
                          },
                          {
                              "id":  "Int32",
                              "hexCode":  "0xD1",
                              "sourceStatus":  "ObservedStatic"
                          },
                          {
                              "id":  "Int64",
                              "hexCode":  "0xD2",
                              "sourceStatus":  "ObservedStatic"
                          },
                          {
                              "id":  "String",
                              "hexCode":  "0xD8",
                              "sourceStatus":  "ObservedStatic"
                          },
                          {
                              "id":  "EoA1",
                              "hexCode":  "0xE0",
                              "sourceStatus":  "ObservedStatic"
                          },
                          {
                              "id":  "EoA2",